{"symbol":"TCELL","market":"BIST","currency":"TRY","dates":["2024-09-19","2024-09-20","2024-09-23","2024-09-24","2024-09-25","2024-09-26","2024-09-27","2024-09-30","2024-10-01","2024-10-02","2024-10-03","2024-10-04","2024-10-07","2024-10-08","2024-10-09","2024-10-10","2024-10-11","2024-10-14","2024-10-15","2024-10-16","2024-10-17","2024-10-18","2024-10-21","2024-10-22","2024-10-23","2024-10-24","2024-10-25","2024-10-28","2024-10-30","2024-10-31","2024-11-01","2024-11-04","2024-11-05","2024-11-06","2024-11-07","2024-11-08","2024-11-11","2024-11-12","2024-11-13","2024-11-14","2024-11-15","2024-11-18","2024-11-19","2024-11-20","2024-11-21","2024-11-22","2024-11-25","2024-11-26","2024-11-27","2024-11-28","2024-11-29","2024-12-02","2024-12-03","2024-12-04","2024-12-05","2024-12-06","2024-12-09","2024-12-10","2024-12-11","2024-12-12","2024-12-13","2024-12-16","2024-12-17","2024-12-18","2024-12-19","2024-12-20","2024-12-23","2024-12-24","2024-12-25","2024-12-26","2024-12-27","2024-12-30","2024-12-31","2025-01-02","2025-01-03","2025-01-06","2025-01-07","2025-01-08","2025-01-09","2025-01-10","2025-01-13","2025-01-14","2025-01-15","2025-01-16","2025-01-17","2025-01-20","2025-01-21","2025-01-22","2025-01-23","2025-01-24","2025-01-27","2025-01-28","2025-01-29","2025-01-30","2025-01-31","2025-02-03","2025-02-04","2025-02-05","2025-02-06","2025-02-07","2025-02-10","2025-02-11","2025-02-12","2025-02-13","2025-02-14","2025-02-17","2025-02-18","2025-02-19","2025-02-20","2025-02-21","2025-02-24","2025-02-25","2025-02-26","2025-02-27","2025-02-28","2025-03-03","2025-03-04","2025-03-05","2025-03-06","2025-03-07","2025-03-10","2025-03-11","2025-03-12","2025-03-13","2025-03-14","2025-03-17","2025-03-18","2025-03-19","2025-03-20","2025-03-21","2025-03-24","2025-03-25","2025-03-26","2025-03-27","2025-03-28","2025-04-02","2025-04-03","2025-04-04","2025-04-07","2025-04-08","2025-04-09","2025-04-10","2025-04-11","2025-04-14","2025-04-15","2025-04-16","2025-04-17","2025-04-18","2025-04-21","2025-04-22","2025-04-24","2025-04-25","2025-04-28","2025-04-29","2025-04-30","2025-05-02","2025-05-05","2025-05-06","2025-05-07","2025-05-08","2025-05-09","2025-05-12","2025-05-13","2025-05-14","2025-05-15","2025-05-16","2025-05-20","2025-05-21","2025-05-22","2025-05-23","2025-05-26","2025-05-27","2025-05-28","2025-05-29","2025-05-30","2025-06-02","2025-06-03","2025-06-04","2025-06-05","2025-06-10","2025-06-11","2025-06-12","2025-06-13","2025-06-16","2025-06-17","2025-06-18","2025-06-19","2025-06-20","2025-06-23","2025-06-24","2025-06-25","2025-06-26","2025-06-27","2025-06-30","2025-07-01","2025-07-02","2025-07-03","2025-07-04","2025-07-07","2025-07-08","2025-07-09","2025-07-10","2025-07-11","2025-07-14","2025-07-16","2025-07-17","2025-07-18","2025-07-21","2025-07-22","2025-07-23","2025-07-24","2025-07-25","2025-07-28","2025-07-29","2025-07-30","2025-07-31","2025-08-01","2025-08-04","2025-08-05","2025-08-06","2025-08-07","2025-08-08","2025-08-11","2025-08-12","2025-08-13","2025-08-14","2025-08-15","2025-08-18","2025-08-19","2025-08-20","2025-08-21","2025-08-22","2025-08-25","2025-08-26","2025-08-27","2025-08-28","2025-08-29","2025-09-01","2025-09-02","2025-09-03","2025-09-04","2025-09-05","2025-09-08","2025-09-09","2025-09-10","2025-09-11","2025-09-12","2025-09-15","2025-09-16","2025-09-17","2025-09-18","2025-09-19","2025-09-22","2025-09-23","2025-09-24","2025-09-25","2025-09-26","2025-09-29","2025-09-30","2025-10-01","2025-10-02","2025-10-03","2025-10-06","2025-10-07","2025-10-08","2025-10-09","2025-10-10","2025-10-13","2025-10-14","2025-10-15","2025-10-16","2025-10-17","2025-10-20","2025-10-21","2025-10-22","2025-10-23","2025-10-24","2025-10-27","2025-10-28","2025-10-30","2025-10-31","2025-11-03","2025-11-04","2025-11-05","2025-11-06","2025-11-07","2025-11-10","2025-11-11","2025-11-12","2025-11-13","2025-11-14","2025-11-17","2025-11-18","2025-11-19","2025-11-20","2025-11-21","2025-11-24","2025-11-25","2025-11-26","2025-11-27","2025-11-28","2025-12-01","2025-12-02","2025-12-03","2025-12-04","2025-12-05","2025-12-08","2025-12-09","2025-12-10","2025-12-11","2025-12-12","2025-12-15","2025-12-16","2025-12-17","2025-12-18","2025-12-19","2025-12-22","2025-12-23","2025-12-24","2025-12-25","2025-12-26","2025-12-29","2025-12-30","2025-12-31","2026-01-02","2026-01-05","2026-01-06","2026-01-07","2026-01-08","2026-01-09","2026-01-12","2026-01-13","2026-01-14","2026-01-15","2026-01-16","2026-01-19","2026-01-20","2026-01-21","2026-01-22","2026-01-23","2026-01-26","2026-01-27","2026-01-28","2026-01-29","2026-01-30","2026-02-02","2026-02-03","2026-02-04","2026-02-05","2026-02-06","2026-02-09","2026-02-10","2026-02-11","2026-02-12","2026-02-13","2026-02-16","2026-02-17","2026-02-18","2026-02-19","2026-02-20","2026-02-23","2026-02-24","2026-02-25","2026-02-26","2026-02-27","2026-03-02","2026-03-03","2026-03-04","2026-03-05","2026-03-06","2026-03-09","2026-03-10","2026-03-11","2026-03-12","2026-03-13","2026-03-16","2026-03-17","2026-03-18","2026-03-19","2026-03-23","2026-03-24","2026-03-25","2026-03-26","2026-03-27","2026-03-30","2026-03-31","2026-04-01","2026-04-02","2026-04-03","2026-04-06","2026-04-07","2026-04-08","2026-04-09","2026-04-10","2026-04-13","2026-04-14","2026-04-15","2026-04-16","2026-04-17","2026-04-20","2026-04-21","2026-04-22","2026-04-24","2026-04-27","2026-04-28","2026-04-29","2026-04-30","2026-05-04","2026-05-05","2026-05-06","2026-05-07","2026-05-08","2026-05-11","2026-05-12","2026-05-13","2026-05-14","2026-05-15","2026-05-18","2026-05-20","2026-05-21","2026-05-22","2026-05-25","2026-05-26","2026-05-27","2026-05-28","2026-05-29","2026-06-01","2026-06-02","2026-06-03","2026-06-04","2026-06-05","2026-06-08","2026-06-09","2026-06-10","2026-06-11","2026-06-12","2026-06-15","2026-06-16","2026-06-17","2026-06-18","2026-06-19","2026-06-22","2026-06-23","2026-06-24","2026-06-25","2026-06-26","2026-06-29","2026-06-30","2026-07-01","2026-07-02","2026-07-03","2026-07-06","2026-07-07","2026-07-08","2026-07-09","2026-07-10","2026-07-13","2026-07-14","2026-07-16","2026-07-17","2026-07-20","2026-07-21","2026-07-22","2026-07-23","2026-07-24","2026-07-27","2026-07-28","2026-07-29","2026-07-30","2026-07-31","2026-08-03","2026-08-04","2026-08-05","2026-08-06","2026-08-07","2026-08-10","2026-08-11","2026-08-12","2026-08-13","2026-08-14","2026-08-17","2026-08-18","2026-08-19","2026-08-20","2026-08-21","2026-08-24","2026-08-25","2026-08-26","2026-08-27","2026-08-28","2026-08-31","2026-09-01","2026-09-02","2026-09-03","2026-09-04","2026-09-07","2026-09-08","2026-09-09","2026-09-10","2026-09-11","2026-09-14","2026-09-15","2026-09-16","2026-09-17","2026-09-18","2026-09-21","2026-09-22","2026-09-23","2026-09-24","2026-09-25","2026-09-28","2026-09-29","2026-09-30","2026-10-01","2026-10-02","2026-10-05","2026-10-06","2026-10-07","2026-10-08","2026-10-09"],"closes":[93.8,93.6,94.75,97.3,95.9,95.75,96.35,95.2,91.75,89.9,86.95,84.35,82.35,82.35,87.05,86.25,84.1,84.25,86.4,88,87.25,85.1,85.5,87.7,87,87,87.75,87.7,87.8,84.75,85.85,84.65,83.55,85.1,89,91.4,95.7,95.95,94.75,96,94.6,92.25,92.45,94,96,93.15,93.4,93.05,93.05,91.3,90.55,91.85,93.9,94.15,92.15,94.3,93.8,93.85,92.8,93.5,96,96.05,95.8,97.25,93.6,91.45,90.7,92.05,93.75,93.2,94.05,93.15,92.8,96.05,98.5,97.95,97.5,96.85,96.3,95.65,94.65,95.2,95.9,98.45,100.3,99.7,102,105,106.2,106.4,106.1,108.9,108,107.4,108.1,105.6,107.5,105.9,107.1,106,107,108.5,107.9,107.4,106.3,104,105,104.9,106.8,105.5,103.7,104.2,105.3,107.7,100.7,100.5,101.5,104.4,107.4,106,104.7,103.4,106,107.5,109.4,109.4,109.2,98.3,97.1,87.4,89.6,94.8,93.9,93.2,95.8,94.35,92,88.3,88.45,90.65,89.7,89.8,90.7,89.9,89.9,88.55,91.65,93,93.5,92.1,94.15,91.3,90.55,91.3,89.9,89.1,86.55,87.35,87.9,90.05,92.3,97.45,95.75,97.05,96.5,96.7,98.45,97.35,99.75,98,98.5,98,96.05,95.5,94.85,91,94.05,98.15,97.1,97.1,97.1,95.7,92.5,92.65,90.95,90.9,88.6,89.85,88.15,91.7,92.95,89.5,89.3,96.15,98.5,98.1,98,98.95,97,94,95.25,93.7,92.4,92.3,92.25,94.1,94.55,95.55,95.1,94.35,94.25,92.5,92.55,91.1,93.55,93.25,93.25,93.4,93.35,93,94.95,96.3,97.25,97.55,97.75,94.6,94.75,94.1,95.2,97.65,99,97.85,99.05,99.8,99.6,96.75,94.8,93.25,91.2,90.65,90.5,90.05,88.9,89.1,88.75,88.65,89.45,93.65,95.2,95.75,94.8,97,98.9,99.05,99.6,98.2,96.9,97.3,97.85,99.5,101.4,98.1,98.8,100.4,98.45,100.4,100.2,97.9,90.85,95.75,95.8,94.25,96.8,96.95,97.6,98.55,100.8,100,100.6,98.75,99.7,97.45,96.45,97.7,102,96.9,96.45,94.4,96.3,95.6,93.15,93.1,94,94.65,96.7,94.7,94.4,94,94.1,94.6,93.55,95.85,97.25,97.75,97.15,98,100.8,101.7,101.2,100.5,104.2,105.4,101.8,102.1,101.9,101,99.5,98.7,98.6,98.65,95.25,93.95,93.5,93.1,96,96.8,99.1,98.8,99.65,98.3,99.55,101.7,101.7,103.7,105.9,105.8,104.5,105.5,112.1,112.8,114.8,114.4,115.9,117.3,116.9,113.5,118.5,118.3,116.1,114.3,117,118.1,122.1,123.9,125.3,127.5,126,124.6,120.2,122.8,123.1,121.5,121,120.8,115.8,114,113.3,111,109.7,107.5,106.9,111.5,109.1,111.3,108.8,109.1,110.8,108.5,106.6,108.4,106.2,107.4,106,106.4,104.6,105.9,107.2,106.9,107.5,108.6,104.9,111.2,114.4,117.3,115.7,116.3,117.1,117.3,120.5,117.7,115.3,114.1,114.3,116.6,113.8,112.1,112.1,111,115.2,117.7,118.6,120,121.9,115,114,114.5,109.5,106.8,108.6,106,106.5,106.1,101,101,101,101,102.6,108.5,105.8,107.9,105.1,107.4,105.5,104.6,107.5,110.7,114.9,115.2,112.1,116,113.4,113.2,111,110.4,110.5,110.9,109.6,107.4,108.7,108.4,107.2,108.6,108.2,105.4,104.9,107,109,110.2,112.2,108.5,109.6,111.5,111,105,103.7,102.3,101.7,101.4,101.5,99.95,104.5,107.6,105.1,105.3,105.1,105.3,103.1,104.1,103.1,104.1,102.9,103.5,104,102.8,104.3,103.1,102.7,103.5,102.8,103.5,95.05,96.55,97.2,96.6,98.15,99.05,101.6,101.8,101.6,103.7,102.4,99.4,95.75,99.15,97.2,99.9,100.3,100.8,99.45,99.95,98.35,98.25,96.1,97.7,97.8,100.5,100.7,99.4,100.2,100.3]}
