{"symbol":"FCX","market":"US","currency":"USD","dates":["2024-09-09","2024-09-10","2024-09-11","2024-09-12","2024-09-13","2024-09-16","2024-09-17","2024-09-18","2024-09-19","2024-09-20","2024-09-23","2024-09-24","2024-09-25","2024-09-26","2024-09-27","2024-09-30","2024-10-01","2024-10-02","2024-10-03","2024-10-04","2024-10-07","2024-10-08","2024-10-09","2024-10-10","2024-10-11","2024-10-14","2024-10-15","2024-10-16","2024-10-17","2024-10-18","2024-10-21","2024-10-22","2024-10-23","2024-10-24","2024-10-25","2024-10-28","2024-10-29","2024-10-30","2024-10-31","2024-11-01","2024-11-04","2024-11-05","2024-11-06","2024-11-07","2024-11-08","2024-11-11","2024-11-12","2024-11-13","2024-11-14","2024-11-15","2024-11-18","2024-11-19","2024-11-20","2024-11-21","2024-11-22","2024-11-25","2024-11-26","2024-11-27","2024-11-29","2024-12-02","2024-12-03","2024-12-04","2024-12-05","2024-12-06","2024-12-09","2024-12-10","2024-12-11","2024-12-12","2024-12-13","2024-12-16","2024-12-17","2024-12-18","2024-12-19","2024-12-20","2024-12-23","2024-12-24","2024-12-26","2024-12-27","2024-12-30","2024-12-31","2025-01-02","2025-01-03","2025-01-06","2025-01-07","2025-01-08","2025-01-10","2025-01-13","2025-01-14","2025-01-15","2025-01-16","2025-01-17","2025-01-21","2025-01-22","2025-01-23","2025-01-24","2025-01-27","2025-01-28","2025-01-29","2025-01-30","2025-01-31","2025-02-03","2025-02-04","2025-02-05","2025-02-06","2025-02-07","2025-02-10","2025-02-11","2025-02-12","2025-02-13","2025-02-14","2025-02-18","2025-02-19","2025-02-20","2025-02-21","2025-02-24","2025-02-25","2025-02-26","2025-02-27","2025-02-28","2025-03-03","2025-03-04","2025-03-05","2025-03-06","2025-03-07","2025-03-10","2025-03-11","2025-03-12","2025-03-13","2025-03-14","2025-03-17","2025-03-18","2025-03-19","2025-03-20","2025-03-21","2025-03-24","2025-03-25","2025-03-26","2025-03-27","2025-03-28","2025-03-31","2025-04-01","2025-04-02","2025-04-03","2025-04-04","2025-04-07","2025-04-08","2025-04-09","2025-04-10","2025-04-11","2025-04-14","2025-04-15","2025-04-16","2025-04-17","2025-04-21","2025-04-22","2025-04-23","2025-04-24","2025-04-25","2025-04-28","2025-04-29","2025-04-30","2025-05-01","2025-05-02","2025-05-05","2025-05-06","2025-05-07","2025-05-08","2025-05-09","2025-05-12","2025-05-13","2025-05-14","2025-05-15","2025-05-16","2025-05-19","2025-05-20","2025-05-21","2025-05-22","2025-05-23","2025-05-27","2025-05-28","2025-05-29","2025-05-30","2025-06-02","2025-06-03","2025-06-04","2025-06-05","2025-06-06","2025-06-09","2025-06-10","2025-06-11","2025-06-12","2025-06-13","2025-06-16","2025-06-17","2025-06-18","2025-06-20","2025-06-23","2025-06-24","2025-06-25","2025-06-26","2025-06-27","2025-06-30","2025-07-01","2025-07-02","2025-07-03","2025-07-07","2025-07-08","2025-07-09","2025-07-10","2025-07-11","2025-07-14","2025-07-15","2025-07-16","2025-07-17","2025-07-18","2025-07-21","2025-07-22","2025-07-23","2025-07-24","2025-07-25","2025-07-28","2025-07-29","2025-07-30","2025-07-31","2025-08-01","2025-08-04","2025-08-05","2025-08-06","2025-08-07","2025-08-08","2025-08-11","2025-08-12","2025-08-13","2025-08-14","2025-08-15","2025-08-18","2025-08-19","2025-08-20","2025-08-21","2025-08-22","2025-08-25","2025-08-26","2025-08-27","2025-08-28","2025-08-29","2025-09-02","2025-09-03","2025-09-04","2025-09-05","2025-09-08","2025-09-09","2025-09-10","2025-09-11","2025-09-12","2025-09-15","2025-09-16","2025-09-17","2025-09-18","2025-09-19","2025-09-22","2025-09-23","2025-09-24","2025-09-25","2025-09-26","2025-09-29","2025-09-30","2025-10-01","2025-10-02","2025-10-03","2025-10-06","2025-10-07","2025-10-08","2025-10-09","2025-10-10","2025-10-13","2025-10-14","2025-10-15","2025-10-16","2025-10-17","2025-10-20","2025-10-21","2025-10-22","2025-10-23","2025-10-24","2025-10-27","2025-10-28","2025-10-29","2025-10-30","2025-10-31","2025-11-03","2025-11-04","2025-11-05","2025-11-06","2025-11-07","2025-11-10","2025-11-11","2025-11-12","2025-11-13","2025-11-14","2025-11-17","2025-11-18","2025-11-19","2025-11-20","2025-11-21","2025-11-24","2025-11-25","2025-11-26","2025-11-28","2025-12-01","2025-12-02","2025-12-03","2025-12-04","2025-12-05","2025-12-08","2025-12-09","2025-12-10","2025-12-11","2025-12-12","2025-12-15","2025-12-16","2025-12-17","2025-12-18","2025-12-19","2025-12-22","2025-12-23","2025-12-24","2025-12-26","2025-12-29","2025-12-30","2025-12-31","2026-01-02","2026-01-05","2026-01-06","2026-01-07","2026-01-08","2026-01-09","2026-01-12","2026-01-13","2026-01-14","2026-01-15","2026-01-16","2026-01-20","2026-01-21","2026-01-22","2026-01-23","2026-01-26","2026-01-27","2026-01-28","2026-01-29","2026-01-30","2026-02-02","2026-02-03","2026-02-04","2026-02-05","2026-02-06","2026-02-09","2026-02-10","2026-02-11","2026-02-12","2026-02-13","2026-02-17","2026-02-18","2026-02-19","2026-02-20","2026-02-23","2026-02-24","2026-02-25","2026-02-26","2026-02-27","2026-03-02","2026-03-03","2026-03-04","2026-03-05","2026-03-06","2026-03-09","2026-03-10","2026-03-11","2026-03-12","2026-03-13","2026-03-16","2026-03-17","2026-03-18","2026-03-19","2026-03-20","2026-03-23","2026-03-24","2026-03-25","2026-03-26","2026-03-27","2026-03-30","2026-03-31","2026-04-01","2026-04-02","2026-04-06","2026-04-07","2026-04-08","2026-04-09","2026-04-10","2026-04-13","2026-04-14","2026-04-15","2026-04-16","2026-04-17","2026-04-20","2026-04-21","2026-04-22","2026-04-23","2026-04-24","2026-04-27","2026-04-28","2026-04-29","2026-04-30","2026-05-01","2026-05-04","2026-05-05","2026-05-06","2026-05-07","2026-05-08","2026-05-11","2026-05-12","2026-05-13","2026-05-14","2026-05-15","2026-05-18","2026-05-19","2026-05-20","2026-05-21","2026-05-22","2026-05-26","2026-05-27","2026-05-28","2026-05-29","2026-06-01","2026-06-02","2026-06-03","2026-06-04","2026-06-05","2026-06-08","2026-06-09","2026-06-10","2026-06-11","2026-06-12","2026-06-15","2026-06-16","2026-06-17","2026-06-18","2026-06-22","2026-06-23","2026-06-24","2026-06-25","2026-06-26","2026-06-29","2026-06-30","2026-07-01","2026-07-02","2026-07-06","2026-07-07","2026-07-08","2026-07-09","2026-07-10","2026-07-13","2026-07-14","2026-07-15","2026-07-16","2026-07-17","2026-07-20","2026-07-21","2026-07-22","2026-07-23","2026-07-24","2026-07-27","2026-07-28","2026-07-29","2026-07-30","2026-07-31","2026-08-03","2026-08-04","2026-08-05","2026-08-06","2026-08-07","2026-08-10","2026-08-11","2026-08-12","2026-08-13","2026-08-14","2026-08-17","2026-08-18","2026-08-19","2026-08-20","2026-08-21","2026-08-24","2026-08-25","2026-08-26","2026-08-27","2026-08-28","2026-08-31","2026-09-01","2026-09-02","2026-09-03","2026-09-04","2026-09-08","2026-09-09","2026-09-10","2026-09-11","2026-09-14","2026-09-15","2026-09-16","2026-09-17","2026-09-18","2026-09-21","2026-09-22","2026-09-23","2026-09-24","2026-09-25","2026-09-28","2026-09-29","2026-09-30","2026-10-01","2026-10-02","2026-10-05"],"closes":[40.4,40.41,41.3,41.81,42.66,42.89,43.13,43.92,45.14,44.53,45.14,48.72,48.31,51.91,51.34,49.92,50.38,50.82,49.77,50.55,50.79,48.59,48.87,49.54,50.03,48.86,47.28,47.97,47.95,48.18,47.94,48.53,47.92,46.84,46.6,46.73,46.57,45.97,45.02,45.59,46.27,46.99,46.87,48.58,46.36,44.9,43.6,43.12,43.27,42.7,43.55,44.12,43.7,43.76,43.72,44.38,43.48,43.76,44.2,43.64,43.83,43.04,42.79,42.07,43.73,42.67,43,42.08,41.59,40.74,40.62,38.71,38.24,38.86,39.25,39.22,39.19,38.86,38.16,38.08,37.88,37.71,38.57,38.74,39.74,38.98,39.41,39.5,40.03,40.03,40.22,40.3,39.09,38.5,37.81,36.67,35.84,36.28,36.64,35.85,35.86,36.48,36.68,37.15,38.22,38.46,37.59,37.96,40.22,39.47,39.3,38.57,38.96,36.98,37.11,36.76,37.95,37.42,36.91,35.53,34.9,38.16,37.68,36.94,34.5,35.88,36.78,37.58,38.85,39.51,39.84,40.42,40.7,40.25,41.61,43.01,41.49,39.98,38.42,37.86,38.13,38.2,33.51,29.15,30.37,29.21,33.74,31.35,33.35,33.75,33.37,33.32,32.9,32.95,34.06,35.19,37.63,37.35,37.24,37.17,36.03,36.41,37.6,37.35,37.92,37.02,37.48,37.86,39.11,39.47,39.06,38.47,38.02,38.8,38.4,38.01,37.7,39.02,39.64,38.89,39.03,38.48,40.15,40.24,40.86,41.69,41.48,42.34,42.19,41.01,41.18,40.94,41.91,41.37,41.18,40.22,40.94,42.01,41.61,44.46,43.87,43.35,44.05,45.77,45.8,45.13,46.27,45.59,47.21,46.36,45.63,44.12,43.98,44.46,44.8,45.19,45.8,44.84,44.58,44.89,43.79,43.23,39.14,40.24,40.03,40.42,40.03,39.86,40.8,41.87,41.46,42.15,42.74,42.28,42.36,41.75,41.46,41.31,41.72,43.28,43.69,44.35,43.87,44.37,44.4,44.94,46.21,46.07,46.34,46.66,43.89,44.88,45.92,44.72,45.64,45.3,45.09,44.93,44.94,45.16,45.36,37.67,35.34,35.75,37.12,39.22,39.09,38.87,39.67,40.32,40.69,42.85,43.31,40.88,42.78,41.97,41.71,41.7,41.18,42.19,41.31,40.78,41.23,41.37,41.1,41.17,42.19,41.73,41.7,41.18,39.42,40.21,38.65,39.81,40.95,41.07,41.81,40.54,40.16,39,40,41.25,39.63,39.87,40.79,41.07,42.15,42.98,43.07,42.97,44.53,44.61,45.2,45,44.8,46.45,48.11,47.38,47.52,47.54,47.82,47.92,49.15,50.64,51.9,51.92,53.04,51.48,51.41,50.79,51.93,54.41,56.15,55.5,54.22,56.53,58.71,59.34,60.35,59.96,58.71,60.07,60.58,58.85,60.41,61.17,62.87,63.63,65.13,60.23,60.76,64.67,61.86,59.22,60.67,63.61,63.26,65.46,62.04,62.84,61.09,62.55,62.57,64.34,65.55,67.88,68.82,68.38,68.08,68.29,65.57,65.93,62.66,59.36,60.49,62.4,61.54,59.21,56.38,57.93,58.09,55.45,53.62,52.09,54.94,56.48,57.09,55.83,56.24,54.65,58.78,61.2,61.38,61.05,60.76,65.1,66.45,67.8,68.03,68.27,68.7,68.28,70.21,70.18,67.57,70.36,61.48,61.05,60.57,58.21,56.93,57.78,56.55,55.57,57.68,60.89,60.61,61.65,64.37,66.03,67.16,66.14,63.01,60.5,58.7,60.87,62.31,61.99,64.36,63.63,65.87,65.71,67.04,71.72,70.64,69.69,63.37,63.91,64.25,62.08,66.34,68.41,70.13,70.15,69.06,68.68,69.21,64.4,61.84,62.8,62.45,61.62,62.89,60.53,60.97,61,59.33,57.5,60.53,61.52,59.97,61.95,60.97,58.56,58.38,58.79,62.56,65,63.5,62.6,62.72,61.64,59.99,63.44,62.63,63.64,67.3,69.39,68.18,69.62,70.51,68.87,69.22,66.83,66.49,68.38,66.32,69.09,71.22,76.66,77.8,79.91,79,78.42,76.45,75.74,72.47,73.93,72.56,72.73,76.62,76.23,71.21,71.07,69.34,69.38,69.24,70.85,71.54,72.16,74.35,72.58,72.08,72.31,71.96,70.79,70,69.28,72.04,72.6]}
